{
  "schema": "cgqa.payment-fulfillment-contract.v0.1",
  "providerId": "x402-v2-http-public",
  "profileVersion": "0.1",
  "financialFinalityEvidenceSources": [
    "settlement-response",
    "payment-response-header"
  ],
  "fulfillmentEvidenceSources": [
    "client-http-response",
    "client-transport-outcome"
  ],
  "financialFinalityImpliesFulfillment": false,
  "fulfillmentRecoveryStatus": "unresolved",
  "publicContractRefs": [
    "https://docs.x402.org/core-concepts/client-server",
    "https://docs.x402.org/core-concepts/http-402",
    "https://docs.x402.org/core-concepts/facilitator",
    "https://docs.x402.org/getting-started/quickstart-for-buyers",
    "https://github.com/x402-foundation/x402"
  ],
  "openQuestions": [
    "If settlement succeeds but the final HTTP response carrying both the paid resource and PAYMENT-RESPONSE is lost, what protocol-level recovery path lets the buyer reconcile fulfillment without making another payment?",
    "Is replay of the same PAYMENT-SIGNATURE after a lost final response a defined recovery operation across every supported scheme/network pair, or is behavior scheme-specific?",
    "What evidence should an autonomous buyer treat as canonical for resource delivery when financial settlement is independently known to have committed?"
  ]
}
